idFormation;forTitre;forDescription;forDate;forDurée (h);forPrix;forTypeFormation;forAdresse
;Scrum;"Cours pour connaître une méthode de gestion de projet ""agile""";2017-12-04;16;500;Interne;1004, Lausanne, Rue de Sébeillon 12
;Bureautique;Cours pour maitriser les outils de la suite Office;2017-08-28;5;1500;Interne;1509, Viefvillers, Rue d'Abbeville 71
;WebStatique;Cours pour créer un site web en HTML et CSS;2018-06-04;8;2350;Externe;1004, Lausanne, Rue de Sébeillon 12
;WebSession;Cours pour faire ajouter de la prog en php;2017-12-06;2;450;Interne;1802, Fontenay-le-Fleury, Rue de la Faisanderie 16
;WebDynamiqueDB;Cours pour relier une base de données à un site web;2017-07-02;17;800;Externe;1882, Nieul-sur-Mer, Rue du Capitaine-Tarron 27
;Données;Cours pour reconnaitre et trier des données;2017-11-15;56;4560;Externe;1004, Lausanne, Rue de Sébeillon 12
;ImplementerUnModele;Cours pour savoir modéliser les données;2017-09-19;40;4562;Interne;1104, Seysses, Place de l'Europe 33
;SQLTraiterDB;Cours pour créer une base de données;2017-11-16;9;1470;Externe;1004, Lausanne, Rue de Sébeillon 12
;Hardware;Cours pour apprendre les composants d'un ordinateur;2017-08-28;7;550;Interne;1004, Lausanne, Rue de Sébeillon 12
;HardwareOsAdvanced;cours pour connaitre la fonction des composants d'un ordinateur;2018-04-11;22;7000;Interne;1949, Tournebu, Rue Francisque-Gay 56
;ProjetMandatAutonome;Cours pour savoir gérer les projets;2017-12-24;13;1000;Externe;1022, Marseille, Rue Guillaume-Tell 33
;ProjetInformatique;cours pour connaitre la fonction des composants d'un ordinateur;2017-10-22;14;3500;Externe;1201, Saint-Sauveur, Rue Caulaincourt 75
;ReseauPME;Cours pour apprendre les composants d'un réseau informatique;2018-03-11;18;4000;Externe;1004, Lausanne, Rue de Sébeillon 12
;ComposantReseau;Cours pour approfondire les connaissances sur le composants réseaux;2017-09-18;20;5480;Interne;1004, Lausanne, Rue de Sébeillon 12
;PeripheriquesReseau;Cours pour savoir configurer les éléments réseaux;2018-03-29;17;445;Interne;1848, Antorpe, Rue Herschel 74
;RelierUneEntrepriseAInternet;Cours pour savoir comment une entreprise peut s'assurer un accès intenet;2018-05-21;11;2450;Externe;1004, Lausanne, Rue de Sébeillon 12
;ExploitationServeur;Cours pour savoir assurer des services de manière redondante;2017-10-16;18;5250;Interne;1970, Val-d'Isère, Rue de l'Hirondelle 61
;ProgrammationProcedurale;Cours pour avoir une approche de la programmation;2018-05-20;8;3500;Externe;1004, Lausanne, Rue de Sébeillon 12
;ProgrammationOrienteeObjets;Cours pour faire de la programmation avec un interface graphique;2018-05-27;5;1550;Interne;1686, Vétrigne, Avenue de la Chapelle 60
;ImplementerOrienteObjets;Cours pour apprendre à faire des classes;2018-05-21;7;100;Externe;1686, Vétrigne, Avenue de la Chapelle 60
